{"artifacts":{"hash_algo":"sha256","items":[{"bytes_hash":"cd57087b51089acb7223cbe698ff4283270d6d966b99325e5cb641ff48525312","cid":"cid_kw_schema_v1_1","media_type":"application/schema+json","note":"KernelWitness v1.1 JSON Schema"},{"bytes_hash":"dab05a18ebd00026aa8f6200a5da467924948f3998f5018d749048684307c00a","cid":"cid_kw_verifier_v1_1","media_type":"text/x-rust","note":"KernelWitness verifier source (pinned)"}]},"domain":{"domain_name":"kernel","domain_version":"1.1","schema_cid":"cid_kw_schema_v1_1","verifier_cid":"cid_kw_verifier_v1_1"},"kernel":{"descent_Phi":[[0,0,0],[0,0,1],[0,0,0]],"entropy":{"kind":"termination_height_under_Phi"},"nilpotence_k":2,"projection_P":[[1,0,0],[0,0,0],[0,0,0]],"samples":[{"expect_height":2,"x0":[0,0,1]},{"expect_height":1,"x0":[0,1,0]},{"expect_height":2,"x0":[0,1,1]},{"expect_height":0,"x0":[0,0,0]}],"space":{"dim":3}},"run":{"cid_run":"8c31efeb656ba3cc82ef20e092d30ee139f2b8039dc5e8541fab267e253c3e92","cid_run_algo":"sha256","cid_run_blank_fields":["run.cid_run"],"cid_run_field_blank_value":""},"witness_version":"1.1"}
